{
  "id": "44210",
  "marca": "Kubota",
  "modelo": "U48-4",
  "año": 2019,
  "categoria": "maquinaria-construccion",
  "subcategoria": "miniexcavadoras",
  "horas": 3200,
  "potencia": "40 CV",
  "peso_operativo": "4.800 kg",
  "estado": "muy_bueno",
  "inspeccionada": true,
  "informe_inspeccion_url": "https://equipzilla.com/inspecciones/44210.pdf",
  "garantia_meses": 6,
  "precio": 32500,
  "moneda": "EUR",
  "incluye_iva": false,
  "iva_deducible": true,
  "financiable": true,
  "cuota_mensual_desde": 520,
  "descuento": 1500,
  "descuento_hasta": "2026-07-15",
  "ubicacion": { "provincia": "Madrid", "pais": "España" },
  "entrega_disponible": true,
  "marcaje_ce": true,
  "numero_serie": "KBU48-2019-0XXXX",
  "ultima_revision": "2026-04-10",
  "equipamiento": ["Cazo de limpieza", "Martillo hidráulico", "Cabina cerrada con aire", "Oruga de goma nueva"],
  "mercado": "es-ES",
  "imagenes": {
    "operador": ["https://.../44210-operador-1.avif"],
    "catalogo_limpio": ["https://.../44210-catalogo-1.avif"],
    "escena_obra": ["https://.../44210-obra-1.avif"]
  }
}
